assignment3/Section1/best.gemm.csv
Problem,Provider,OperationKind,Operation,Disposition,Status,gemm_kind,m,n,k,A,B,C,D,alpha,beta,split_k_mode,split_k_slices,batch_count,raster_order,runtime_input_datatype_a,runtime_input_datatype_b,use_pdl,enable_sm90_mixed_dtype_shuffle_test,swizzle_size,op_class,accum,cta_m,cta_n,cta_k,cluster_m,cluster_n,cluster_k,cluster_m_fallback,cluster_n_fallback,cluster_k_fallback,stages,warps_m,warps_n,warps_k,inst_m,inst_n,inst_k,min_cc,max_cc,Bytes,Flops,Flops/Byte,Runtime,GB/s,GFLOPs
1,CUTLASS,gemm,cutlass_simt_hgemm_256x128_8x2_nn_align1,passed,success,universal,1152,4096,4096,f16:column,f16:column,f16:column,f16:column,1,0,serial,1,1,heuristic,invalid,invalid,false,false,1,simt,f16,256,128,8,1,1,1,1,1,1,2,4,2,1,1,1,1,50,1024,52428800,38664142848,737,1.54898,31.5227,24961
1,CUTLASS,gemm,cutlass_tensorop_h884gemm_256x128_32x2_nn_align8,passed,success,universal,1152,4096,4096,f16:column,f16:column,f16:column,f16:column,1,0,serial,1,1,heuristic,invalid,invalid,false,false,1,tensorop,f16,256,128,32,1,1,1,1,1,1,2,4,2,1,16,16,4,70,75,52428800,38664142848,737,0.601635,81.1591,64265.1
1,CUTLASS,gemm,cutlass_tensorop_h1688gemm_256x128_32x2_nn_align8,passed,success,universal,1152,4096,4096,f16:column,f16:column,f16:column,f16:column,1,0,serial,1,1,heuristic,invalid,invalid,false,false,1,tensorop,f16,256,128,32,1,1,1,1,1,1,2,4,2,1,16,8,8,75,1024,52428800,38664142848,737,0.337369,144.732,114605
2,CUTLASS,gemm,cutlass_simt_hgemm_256x128_8x2_nn_align1,passed,success,universal,1152,4096,4096,f16:column,f16:column,f16:column,f16:column,1,0,serial,2,1,heuristic,invalid,invalid,false,false,1,simt,f16,256,128,8,1,1,1,1,1,1,2,4,2,1,1,1,1,50,1024,52428800,38664142848,737,1.43481,34.031,26947.2
2,CUTLASS,gemm,cutlass_tensorop_h884gemm_256x128_32x2_nn_align8,passed,success,universal,1152,4096,4096,f16:column,f16:column,f16:column,f16:column,1,0,serial,2,1,heuristic,invalid,invalid,false,false,1,tensorop,f16,256,128,32,1,1,1,1,1,1,2,4,2,1,16,16,4,70,75,52428800,38664142848,737,0.619069,78.8734,62455.3
2,CUTLASS,gemm,cutlass_tensorop_h1688gemm_256x128_32x2_nn_align8,passed,success,universal,1152,4096,4096,f16:column,f16:column,f16:column,f16:column,1,0,serial,2,1,heuristic,invalid,invalid,false,false,1,tensorop,f16,256,128,32,1,1,1,1,1,1,2,4,2,1,16,8,8,75,1024,52428800,38664142848,737,0.358087,136.358,107974
3,CUTLASS,gemm,cutlass_simt_hgemm_256x128_8x2_nn_align1,passed,success,universal,1152,4096,4096,f16:column,f16:column,f16:column,f16:column,1,0,serial,4,1,heuristic,invalid,invalid,false,false,1,simt,f16,256,128,8,1,1,1,1,1,1,2,4,2,1,1,1,1,50,1024,52428800,38664142848,737,1.49928,32.5677,25788.5
3,CUTLASS,gemm,cutlass_tensorop_h884gemm_256x128_32x2_nn_align8,passed,success,universal,1152,4096,4096,f16:column,f16:column,f16:column,f16:column,1,0,serial,4,1,heuristic,invalid,invalid,false,false,1,tensorop,f16,256,128,32,1,1,1,1,1,1,2,4,2,1,16,16,4,70,75,52428800,38664142848,737,0.664919,73.4347,58148.6
3,CUTLASS,gemm,cutlass_tensorop_h1688gemm_256x128_32x2_nn_align8,passed,success,universal,1152,4096,4096,f16:column,f16:column,f16:column,f16:column,1,0,serial,4,1,heuristic,invalid,invalid,false,false,1,tensorop,f16,256,128,32,1,1,1,1,1,1,2,4,2,1,16,8,8,75,1024,52428800,38664142848,737,0.415347,117.56,93088.7
4,CUTLASS,gemm,cutlass_simt_hgemm_256x128_8x2_nn_align1,passed,success,universal,1152,4096,4096,f16:column,f16:column,f16:column,f16:column,1,0,serial,8,1,heuristic,invalid,invalid,false,false,1,simt,f16,256,128,8,1,1,1,1,1,1,2,4,2,1,1,1,1,50,1024,52428800,38664142848,737,1.60029,30.5121,24160.7
4,CUTLASS,gemm,cutlass_tensorop_h884gemm_256x128_32x2_nn_align8,passed,success,universal,1152,4096,4096,f16:column,f16:column,f16:column,f16:column,1,0,serial,8,1,heuristic,invalid,invalid,false,false,1,tensorop,f16,256,128,32,1,1,1,1,1,1,2,4,2,1,16,16,4,70,75,52428800,38664142848,737,0.763484,63.9543,50641.7
4,CUTLASS,gemm,cutlass_tensorop_h1688gemm_256x128_32x2_nn_align8,passed,success,universal,1152,4096,4096,f16:column,f16:column,f16:column,f16:column,1,0,serial,8,1,heuristic,invalid,invalid,false,false,1,tensorop,f16,256,128,32,1,1,1,1,1,1,2,4,2,1,16,8,8,75,1024,52428800,38664142848,737,0.547133,89.2435,70666.8
